Topic,Document.Index,Documents,County
20,457,Mr. President. press reports today from the annual economic summit of the worlds major industrial powers in Denver indicate that there was pressure on the United States from some of our allies to make new commitments to deep cutbacks on greenhouse gas emissions. specifically. carbon dioxide emissions. It is unfortunate that some of our allies. including the French in particular. chose this forum to change the terms of international dialogue on this issue. I commend President Clinton for resisting these surprising. new pressure tactics to shortcut the progress towards a rea.sonable solution at Kyoto and to try to force the United States to endorse an immediate commitment to unworkable new goals. thereby. shredding the negotiating process. We and the French are both part of negotiations intended as a followup to the United Nations Framework Convention on Climate Change. the socalled Rio Pact. signed in 1992. and approved by the Senate. The Rio Pact called upon the industrialized nations to aim to reduce their greenhouse gas emissions to their 1990 levels by the year 2000. a goal which will not be achieved by the U.S. or by most of the industrialized nations. As a result of the failure of most of the industrialized world to meet this voluntary commitment to reduce Carbon dioxide emissions. the parties met in Berlin in 1995 to discuss the future direction of the treaty. In Berlin. the United States agreed that new commitments should be binding upon the signatories. but the developing world was excluded from any new commitments. Unfortunately. excluding the developing world. which will be the most important emitter of carbon dioxide emissions by the year 2015. exceeding the emissions of the OECD nations. was a mistake. The solution. if it is to be effective. must include all major emitting nations or it will fail to really get the problem under control. More than that. the perceived unfairness of forcing limits on the economies of only some nations. but not others. will cause political pressure to frustrate the approval and implementation of any treaty that is signed in Kyoto this December. The temptations of industries to flee from the U.S. for example. behind the safe nonbinding walls of Mexico. for instance. or other developing nations. will both frustrate the goals of a treaty and unfairly penalize the developed economies. Therefore. Mr. President. the distinguished Senator from Nebraska. Mr. HAGEL. and I authored a Sense of the Senate Resolution indicating that it is imperative for the developing world to be parties to any binding commitments made in Kyoto. that those socalled commitments should demonstrate unequivocally an action program to approach this problem in a realistic way. and that everyone should start with aggressive efforts to act on those commitments immediately and not settle for vague promises to return to future negotiations to get serious. While some countries have different levels of development. each must make unique and binding contributions of a kind consistent with their industrialization. The developing world must agree in Kyoto to some manner of binding commitments which would begin at the same time as the developed world with as aggressive and effective a schedule as possible given the gravity of the problem and the need for a fair sharing of the burden. Mr. President. in Denver during the last two days. some nations put pressure on the United States to agree to a whole new set of commitments beyond those agreed to in Rio. beyond the target of stabilizing at 1990 levels by the year 2010. Those nations sought to get the U.S. to agree to a 15 percent reduction by 2010. a level of reduction which would have very serious impacts on major sectors of the U.S. economy. There were no discussions of bringing the developing world into the play. I highly commend President Clinton for resisting these surprising new pressures to deviate from the Kyoto track. and set targets for very sharp new levels of reductions. Those nations should know that the United States Senate stands strongly behind the President in resisting these pressures. Reductions must be fair. .wellmanaged. wellplanned. and spread across the globespread across the globe. In addition. Mr. President. a wideranging new set of initiatives is needed to harness technology. to engage in new crash research and development technologies to mitigate the carbon dioxide emissions from fossil fuel combustion. as .well as new energy efficiency programs. and cooperative programs between the developed and developing world. We have only begun to match the targets of carbon dioxide reductions and limitations with our technological genius and to engage in pioneering a new energy frontier type program aimed at using mans genius to tackle this global problem from every conceivable angle. I reiterate. Mr. President. that President Clinton is to be commended for resisting the pressure for these sudden draconian commitments. Mr. President. i yield the floor.,USA
20,22386,"Mr. President. I want to address a growing misperception concerning the European Unions ability to meet its obligations under the Kyoto Treaty. There are many climate change skeptics who claim that the EU will not be able to meet their greenhouse gas emission reduction targets under the Kyoto Treaty. In turn. they argue that the U.S. should not participate in any ""cap and trade"" system for the reduction of greenhouse gas emissions. Under the Kyoto Treaty. the EU has committed to greenhouse gas reductions target of 8 percent below their 1990 emission levels and covers the years 2008 through 2012. This target is shared by the 15 EU member states. EU15. that existed at the time of the EU ratification of the protocol in May 2001. An additional 10 countries joined the EU in May 2004. eight of which -have individual targets under Kyoto that range from 6 to 8 percent below the 1990 levels. Two of them. Malta and Cyprus. are developing countries and. therefore. do not have any emission targets under the treaty.. In December 2005. the EU. as required by the Kyoto Treaty. reported on the progress made toward reducing greenhouse gas emissions. The report indicated that EU policies and actions by member states to date have made annual carbon dioxide emissions reduction$ of 5.5 percent in the year 2003 across all 25 of the EU member states. EU25. The report makes the following assessments: For the EU15: Existing measures to reduce emissions of greenhouse gases that are projected to be 1.6 percent below the year 1990 levels in 2010. Savings from additional domestic policies and measures being planned by the EU15 would result in total emission reductions of 6.8 percent. EU15 member states forecast that they will be able to achieve lower emissions of 9.3 percent below the year 1990 levels through the use of the Kyoto flexibility mechanisms inthe year 2010. They include such activities as emissions trading. forest sequestration. and participating in International projects -that result in greenhouse gas reductions through the Joint Implementation and Clean Development Mechanism programs. For the EU25: The total of all member states projections of greenhouse gas emissions will be 5 percent below base year levels in. 2010 as a result .of measures already implemented. The implementation of additional measures is projected to reduce the EU25 greenhouse gas emissions to 9.3 percent below 1990 levels by 2010 and. with the use of Kyoto flexibility mechanisms. to 11.3 percent below the year 1990 levels. The December 2005 report concludes that the EU15 states can meet their target of 8 percent below the 1990 levels if the additional domestic measures and the Kyoto flexibility mechanisms that are planned are implemented. According to the February 14. 2006 statement of the acting head of the United Nations Framework Convention on Climate Change. Richard Kinley.. 34 industrialized countries under the Kyoto Treaty were ""on their way to lower their emissions levels by at least 3.5% below the 1990 levels during the firstcommitment period."" ""With the help of additional measures and the use of Kyoto marketbased mechanisms. they will as a group be able reach their agreed Kyoto reduction targets."" In June. the European Environment Agency issued the Annual European Community Greenhouse Gas Inventory 19902004 and Inventory Report 2006. The report indicates that the EU15 greenhouse gas emissions for 2004 increased -by 0.3 percent11.5 million tonnes of carbon dioxide equivalentsover 2003. However. compared to the base year. emissions in 2004 were 0.9 percent lower. Assuming a linear target path from 1990 to 2010. total EU15 greenhouse gas emissions were 4.7 index points above this target path in 2004. It should be noted that this linear target path is not intended as an approximation of past and future emission trends. It does provide a measure of how close the EU15 emissions are in 2004 to a linear path of emissions from 1990 to the Kyoto target period of 2008-. 2012. assuming that only domestic measures will be used. Therefore. it is not a measure of future compliance .of the EU15 with its greenhouse gas emission targets in 20082012. but aims at evaluating overall EU15 greenhouse emissions in 2004 alone. The EU is fully committed to the Kyoto Treaty. It has adopted a series of policies and measures. such as the EUs greenhouse gas emissions tradingscheme. to meet its target in a costeffective manner. The most recent projections show that these measures. together with the EUs participation in the global carbon market. will allow the EU to meet its target. To ensure its compliance with the Kyoto Protocol. the EU has adopted a series of measures under the European Climate Change Programme. ECCP. Most of these measures have recently entered into force and will start to show their full effect over the next few years. These include: The EU greenhouse gas emissions trading scheme. the promotion of electricity from renewable energy sources. the promotion of cogeneration. CHP. increasing the energy performance of buildings. the promotion of the use of biofuels for transport. the reduction of landfilling of biodegradable waste I ask unanimous consent to have printed in the RECORD documents from the European Commission and the European Environmental Agencys reports which summarize the EUs efforts to address climate change. Let me highlight a few of the important elements from these reports for my colleagues.",USA
20,16677,"I welcome my right hon. Friend's statement that she is to approach the European Commission for a hybrid solution to the implementation of the large combustion plants directive. On the question of carbon dioxide, will she say what she is doing, with the DTI, to press for more investment in clean coal technology? If we are to tackle CO 2 emissions, especially in China and India, we need to be able to transfer new clean coal technology to those countries so that we can effect a reduction in CO 2 emissions.",UK
20,19222,"Economic growth may well have contributed to the carbon increase, but I am sure that the hon. Gentleman does not want to advance the proposition that we should avoid economic growth. If we are to have sustained economic growth, as we both want, and if we are serious, which I am and which I suppose he is—certainly the Secretary of State is—about trying to achieve carbon reduction we must find a means of allying it to economic growth, not explaining away carbon increases in terms of economic growth.",UK
20,20880,"My hon. Friend knows that the advent of China and India on the world stage means that carbon emissions will increase enormously. In his speech in New Zealand, the Prime Minister said that if Australia were to shut down for the next 10 months, its contribution to world emissions would be overtaken by new emissions from China. This country has the chance to export clean coal technology to China. If we get our act together, we can help ourselves, China and global emissions.",UK
20,25399,"As a Government, we do not seek to set a particular carbon price—in a market mechanism, it is the market's role to establish that. The Government's role is to ensure sufficient scarcity, and that the market functions properly. The benefit of a cap and trade scheme is that setting a cap gives a certainty that carbon dioxide emissions are being controlled. The EU emissions trading scheme is a significant policy instrument because it covers about half of all Europe's CO2 emissions. We want to make sure that it works even more effectively in the future.",UK
20,25401,"As a Government, we do not seek to set a particular carbon price—in a market mechanism, it is the market's role to establish that. The Government's role is to ensure sufficient scarcity and that the market functions properly. The benefit of a cap and trade scheme is that setting a cap gives a certainty that carbon dioxide emissions are being controlled. The EU emissions trading scheme is a significant policy instrument because it covers about half of all Europe's CO2 emissions. We want to make sure that it works even more effectively in the future.",UK
